{
  "timeline_hash": "07cb58302036490c8c5c84bfe1fbad23f52577e2dad504b1bffaf15e5dbcf010",
  "total_duration_s": 64.5,
  "time_policy": "current",
  "clips": [
    {
      "clip_id": "clip_0fa5a1",
      "source_start": 0.0,
      "source_end": 62.05,
      "speed": 1.0,
      "word_ids": [
        "w_0",
        "w_1",
        "w_2",
        "w_3",
        "w_4",
        "w_5",
        "w_6",
        "w_7",
        "w_8",
        "w_9",
        "w_10",
        "w_11",
        "w_12",
        "w_13",
        "w_14",
        "w_15",
        "w_16",
        "w_17",
        "w_18",
        "w_19",
        "w_20",
        "w_21",
        "w_22",
        "w_23",
        "w_24",
        "w_25",
        "w_26",
        "w_27",
        "w_28",
        "w_29",
        "w_30",
        "w_31"
      ]
    },
    {
      "clip_id": "clip_bce1b0",
      "source_start": 117.55,
      "source_end": 120.0,
      "speed": 1.0,
      "word_ids": [
        "w_55"
      ]
    }
  ],
  "captions": [
    {
      "caption_id": "cap_1",
      "text": "Welcome!",
      "playback_start": 0.5,
      "playback_end": 2.8,
      "style": {
        "color": "red",
        "font_size": 28,
        "position": "bottom",
        "background_box": true,
        "highlight_color": null
      }
    }
  ],
  "effects": [],
  "history": [
    {
      "step_index": 1,
      "instruction": "Add a caption 'Welcome!' when I say welcome to the channel",
      "operations": [
        {
          "op_type": "add_caption",
          "params": {
            "op": "add_caption",
            "caption_id": "cap_1",
            "text": "Welcome!",
            "word_ids": [
              "w_0",
              "w_1",
              "w_2",
              "w_3"
            ]
          }
        }
      ],
      "summary": "Caption attached to those 4 words (original time 0:00-0:02).",
      "timestamp": "",
      "undone": false
    },
    {
      "step_index": 2,
      "instruction": "Cut the first 30 seconds",
      "operations": [
        {
          "op_type": "cut_range",
          "params": {
            "op": "cut_range",
            "source_start": 0.0,
            "source_end": 30.0,
            "policy": "original"
          }
        }
      ],
      "summary": "Video is 30 s shorter.",
      "timestamp": "",
      "undone": true
    },
    {
      "step_index": 3,
      "instruction": "Remove the part about pricing",
      "operations": [
        {
          "op_type": "cut_range",
          "params": {
            "op": "cut_range",
            "source_start": 62.05,
            "source_end": 117.55,
            "policy": "original"
          }
        }
      ],
      "summary": "Applied: removed the selected 1 occurrence(s). New duration: 34.50s.",
      "timestamp": "",
      "undone": false
    },
    {
      "step_index": 4,
      "instruction": "Actually, put the intro back",
      "operations": [
        {
          "op_type": "restore_intro",
          "params": {
            "op": "restore_intro",
            "restored_step": 2
          }
        }
      ],
      "summary": "The first 30 s return; caption back at 0:42; the pricing cut and speed change stay.",
      "timestamp": "",
      "undone": true
    },
    {
      "step_index": 5,
      "instruction": "Make that caption red",
      "operations": [
        {
          "op_type": "update_caption_style",
          "params": {
            "op": "update_caption_style",
            "caption_id": "cap_1",
            "style": {
              "color": "red",
              "font_size": 28,
              "position": "bottom",
              "background_box": true,
              "highlight_color": null
            }
          }
        }
      ],
      "summary": "Applied to the Welcome! caption, the only one that exists.",
      "timestamp": "",
      "undone": false
    }
  ]
}